{
  "schemaVersion": 1,
  "methodologyVersion": "weekly-momentum-v1",
  "windowStart": "2026-10-09T15:57:48.819Z",
  "windowEnd": "2026-10-16T15:57:48.819Z",
  "lastAttemptedAt": "2026-10-16T15:57:48.819Z",
  "lastSuccessfulAt": "2026-10-16T15:57:48.819Z",
  "status": "partial",
  "providers": {
    "gdelt": {
      "status": "unavailable"
    },
    "hackerNews": {
      "status": "ok",
      "sampledAt": "2026-10-16T15:57:48.819Z",
      "itemCount": 200
    },
    "bluesky": {
      "status": "not_configured"
    }
  },
  "entries": [
    {
      "rank": 1,
      "leadStoryId": "content_6ad11ad407038310f8c1eb63",
      "memberStoryIds": [
        "content_6ad11ad407038310f8c1eb63"
      ],
      "category": "models",
      "publishedAt": "2026-10-16T00:00:00.000Z",
      "momentumScore": 0.4211869789445356,
      "signals": {
        "coverage": {
          "state": "observed",
          "basis": "canonical_today_sources",
          "independentOutletCount": 1,
          "sampledDomains": [
            "forbes.com"
          ]
        },
        "hackerNews": {
          "state": "not_observed"
        },
        "recency": {
          "state": "observed",
          "ageHours": 15.963560833333334
        },
        "bluesky": {
          "state": "not_configured"
        }
      }
    },
    {
      "rank": 2,
      "leadStoryId": "content_6ad1b91d43b3bab85c56eea0",
      "memberStoryIds": [
        "content_6ad1b91d43b3bab85c56eea0"
      ],
      "category": "research",
      "publishedAt": "2026-10-16T00:00:00.000Z",
      "momentumScore": 0.4211869789445356,
      "signals": {
        "coverage": {
          "state": "observed",
          "basis": "canonical_today_sources",
          "independentOutletCount": 1,
          "sampledDomains": [
            "forbes.com"
          ]
        },
        "hackerNews": {
          "state": "not_observed"
        },
        "recency": {
          "state": "observed",
          "ageHours": 15.963560833333334
        },
        "bluesky": {
          "state": "not_configured"
        }
      }
    },
    {
      "rank": 3,
      "leadStoryId": "https://huggingface.co/blog/nvidia/scaling-indic-pretraining",
      "memberStoryIds": [
        "https://huggingface.co/blog/nvidia/scaling-indic-pretraining"
      ],
      "category": "ai-lifecycle",
      "publishedAt": "2026-10-16T00:00:00.000Z",
      "momentumScore": 0.4211869789445356,
      "signals": {
        "coverage": {
          "state": "observed",
          "basis": "canonical_today_sources",
          "independentOutletCount": 1,
          "sampledDomains": [
            "huggingface.co"
          ]
        },
        "hackerNews": {
          "state": "not_observed"
        },
        "recency": {
          "state": "observed",
          "ageHours": 15.963560833333334
        },
        "bluesky": {
          "state": "not_configured"
        }
      }
    },
    {
      "rank": 4,
      "leadStoryId": "https://tldr.tech/ai/2026-10-16",
      "memberStoryIds": [
        "https://tldr.tech/ai/2026-10-16"
      ],
      "category": "ai-lifecycle",
      "publishedAt": "2026-10-16T00:00:00.000Z",
      "momentumScore": 0.4211869789445356,
      "signals": {
        "coverage": {
          "state": "observed",
          "basis": "canonical_today_sources",
          "independentOutletCount": 1,
          "sampledDomains": [
            "tldr.tech"
          ]
        },
        "hackerNews": {
          "state": "not_observed"
        },
        "recency": {
          "state": "observed",
          "ageHours": 15.963560833333334
        },
        "bluesky": {
          "state": "not_configured"
        }
      }
    },
    {
      "rank": 5,
      "leadStoryId": "6acfb7fb7efaf68414339c74",
      "memberStoryIds": [
        "6acfb7fb7efaf68414339c74"
      ],
      "category": "models",
      "publishedAt": "2026-10-15T00:00:00.000Z",
      "momentumScore": 0.3803706524139233,
      "signals": {
        "coverage": {
          "state": "observed",
          "basis": "canonical_today_sources",
          "independentOutletCount": 1,
          "sampledDomains": [
            "wired.com"
          ]
        },
        "hackerNews": {
          "state": "not_observed"
        },
        "recency": {
          "state": "observed",
          "ageHours": 39.96356083333333
        },
        "bluesky": {
          "state": "not_configured"
        }
      }
    },
    {
      "rank": 6,
      "leadStoryId": "content_6ad00ab142ded464d60e5c92",
      "memberStoryIds": [
        "content_6ad00ab142ded464d60e5c92"
      ],
      "category": "safety-governance",
      "publishedAt": "2026-10-15T00:00:00.000Z",
      "momentumScore": 0.3803706524139233,
      "signals": {
        "coverage": {
          "state": "observed",
          "basis": "canonical_today_sources",
          "independentOutletCount": 1,
          "sampledDomains": [
            "forbes.com"
          ]
        },
        "hackerNews": {
          "state": "not_observed"
        },
        "recency": {
          "state": "observed",
          "ageHours": 39.96356083333333
        },
        "bluesky": {
          "state": "not_configured"
        }
      }
    },
    {
      "rank": 7,
      "leadStoryId": "content_6ad051ad43b3bab85c56ee02",
      "memberStoryIds": [
        "content_6ad051ad43b3bab85c56ee02"
      ],
      "category": "ai-lifecycle",
      "publishedAt": "2026-10-15T00:00:00.000Z",
      "momentumScore": 0.3803706524139233,
      "signals": {
        "coverage": {
          "state": "observed",
          "basis": "canonical_today_sources",
          "independentOutletCount": 1,
          "sampledDomains": [
            "forbes.com"
          ]
        },
        "hackerNews": {
          "state": "not_observed"
        },
        "recency": {
          "state": "observed",
          "ageHours": 39.96356083333333
        },
        "bluesky": {
          "state": "not_configured"
        }
      }
    },
    {
      "rank": 8,
      "leadStoryId": "content_6ad0f69443b3bab85c56ee35",
      "memberStoryIds": [
        "content_6ad0f69443b3bab85c56ee35"
      ],
      "category": "models",
      "publishedAt": "2026-10-15T00:00:00.000Z",
      "momentumScore": 0.3803706524139233,
      "signals": {
        "coverage": {
          "state": "observed",
          "basis": "canonical_today_sources",
          "independentOutletCount": 1,
          "sampledDomains": [
            "forbes.com"
          ]
        },
        "hackerNews": {
          "state": "not_observed"
        },
        "recency": {
          "state": "observed",
          "ageHours": 39.96356083333333
        },
        "bluesky": {
          "state": "not_configured"
        }
      }
    },
    {
      "rank": 9,
      "leadStoryId": "https://developer.nvidia.com/blog/?p=122698",
      "memberStoryIds": [
        "https://developer.nvidia.com/blog/?p=122698"
      ],
      "category": "ai-lifecycle",
      "publishedAt": "2026-10-15T00:00:00.000Z",
      "momentumScore": 0.3803706524139233,
      "signals": {
        "coverage": {
          "state": "observed",
          "basis": "canonical_today_sources",
          "independentOutletCount": 1,
          "sampledDomains": [
            "developer.nvidia.com"
          ]
        },
        "hackerNews": {
          "state": "not_observed"
        },
        "recency": {
          "state": "observed",
          "ageHours": 39.96356083333333
        },
        "bluesky": {
          "state": "not_configured"
        }
      }
    },
    {
      "rank": 10,
      "leadStoryId": "https://developer.nvidia.com/blog/?p=123590",
      "memberStoryIds": [
        "https://developer.nvidia.com/blog/?p=123590"
      ],
      "category": "research",
      "publishedAt": "2026-10-15T00:00:00.000Z",
      "momentumScore": 0.3803706524139233,
      "signals": {
        "coverage": {
          "state": "observed",
          "basis": "canonical_today_sources",
          "independentOutletCount": 1,
          "sampledDomains": [
            "developer.nvidia.com"
          ]
        },
        "hackerNews": {
          "state": "not_observed"
        },
        "recency": {
          "state": "observed",
          "ageHours": 39.96356083333333
        },
        "bluesky": {
          "state": "not_configured"
        }
      }
    },
    {
      "rank": 11,
      "leadStoryId": "https://huggingface.co/blog/meta-muse-spark-open",
      "memberStoryIds": [
        "https://huggingface.co/blog/meta-muse-spark-open"
      ],
      "category": "models",
      "publishedAt": "2026-10-15T00:00:00.000Z",
      "momentumScore": 0.3803706524139233,
      "signals": {
        "coverage": {
          "state": "observed",
          "basis": "canonical_today_sources",
          "independentOutletCount": 1,
          "sampledDomains": [
            "huggingface.co"
          ]
        },
        "hackerNews": {
          "state": "not_observed"
        },
        "recency": {
          "state": "observed",
          "ageHours": 39.96356083333333
        },
        "bluesky": {
          "state": "not_configured"
        }
      }
    },
    {
      "rank": 12,
      "leadStoryId": "https://techcrunch.com/?p=3178363",
      "memberStoryIds": [
        "https://techcrunch.com/?p=3178363"
      ],
      "category": "safety-governance",
      "publishedAt": "2026-10-15T00:00:00.000Z",
      "momentumScore": 0.3803706524139233,
      "signals": {
        "coverage": {
          "state": "observed",
          "basis": "canonical_today_sources",
          "independentOutletCount": 1,
          "sampledDomains": [
            "techcrunch.com"
          ]
        },
        "hackerNews": {
          "state": "not_observed"
        },
        "recency": {
          "state": "observed",
          "ageHours": 39.96356083333333
        },
        "bluesky": {
          "state": "not_configured"
        }
      }
    }
  ]
}
